{
  "schema_version": "0.1.0",
  "kind": "weights",
  "hash": "wgt_3a9906acb8b042e4781cc10be52bf00b26d754047e092eac3f64c407ae656cc8",
  "name_hints": [
    "nova-lingua-coder-7b",
    "reference-best-write"
  ],
  "base": {
    "model": "Qwen/Qwen2.5-Coder-7B-Instruct",
    "license": "Apache-2.0"
  },
  "format": "lora-peft-safetensors",
  "files": [
    {
      "name": "adapter_config.json",
      "sha256": "4f30c7e80e16b2e978e606e981960485f9b9c1ff668d5a341735f40cd2762121",
      "bytes": 1109
    },
    {
      "name": "adapter_model.safetensors",
      "sha256": "f492f5e0aa96bb352d1e915ba9b9526366fcc72449285baff5ae976c9681eaac",
      "bytes": 161533192
    }
  ],
  "recipe": {
    "corpus": {
      "sha256": "ceb9192fe9330eb4f6c5fba696a3961bc6a4e780483ef53ab90d6c6f993cddfd",
      "description": "gen_corpus.py --combinatorial (verified synthetic training corpus)"
    },
    "train_split": {
      "sha256": "9788ec9b5115fd4af92805c7d22fb9139a3ed041aeea05833895126144ccc54d",
      "examples": 5787,
      "description": "export_finetune.py --conventions off --shots 0 --holdout-corpus (curated eval held out)"
    },
    "trainer": "tooling/eval/train_lora_cpu.py",
    "seed": 1,
    "epochs": 2,
    "hyperparameters": {
      "lora_r": 16,
      "lora_alpha": 32,
      "lora_dropout": 0.05,
      "target_modules": "all attn+MLP proj",
      "max_seq_len": 512,
      "learning_rate": 0.0002,
      "grad_accum": 8,
      "dtype": "bfloat16"
    }
  },
  "measured": {
    "write": {
      "pass": 167,
      "semantic_pass": 167,
      "total": 179
    },
    "read": {
      "pass": 151,
      "semantic_pass": 155,
      "total": 169
    },
    "assemble": {
      "pass": 12,
      "semantic_pass": 12,
      "total": 12
    },
    "total": {
      "pass": 330,
      "semantic_pass": 334,
      "total": 360
    }
  },
  "urls": [
    "https://nl.1105software.com/v0/blobs/4f30c7e80e16b2e978e606e981960485f9b9c1ff668d5a341735f40cd2762121",
    "https://nl.1105software.com/v0/blobs/f492f5e0aa96bb352d1e915ba9b9526366fcc72449285baff5ae976c9681eaac"
  ],
  "derived_from": null,
  "supersedes": null
}
