{
  "schema_version": "0.1.0",
  "kind": "weights",
  "hash": "wgt_846d4e3e32450a290d2365a2a99b26730b0276e40f935f838db25a68dd5295cf",
  "name_hints": [
    "nova-lingua-coder-14b",
    "reference-best-read",
    "reference-best-total"
  ],
  "base": {
    "model": "Qwen/Qwen2.5-Coder-14B-Instruct",
    "license": "Apache-2.0"
  },
  "format": "lora-peft-safetensors",
  "files": [
    {
      "name": "adapter_config.json",
      "sha256": "629dd950c3c6b1a353d5533fa418a87b527d8d8186d3fbf1ca59a604b26d1a3c",
      "bytes": 1164
    },
    {
      "name": "adapter_model.safetensors",
      "sha256": "c80fdef0a3e73835fb12234e36c2c174cdb920f34a49f02266d422c08f3074e9",
      "bytes": 275341720
    }
  ],
  "recipe": {
    "corpus": {
      "sha256": "c670e7413123c677f852a29f70dcd360f9baa78be9c4f94fc48e63a19ef81a23",
      "description": "gen_corpus.py --combinatorial (verified synthetic training corpus)"
    },
    "train_split": {
      "sha256": "ddf7b37d9b19d7f14eabfec255e5d84f0e77cc45b027708ff1f77e5fa27fd6ff",
      "examples": 6315,
      "description": "export_finetune.py --conventions off --shots 0 --holdout-corpus (curated eval held out)"
    },
    "trainer": "tooling/eval/train_lora_cpu.py",
    "seed": 1,
    "epochs": 2,
    "hyperparameters": {
      "lora_r": 16,
      "lora_alpha": 32,
      "lora_dropout": 0.05,
      "target_modules": "all attn+MLP proj",
      "max_seq_len": 512,
      "learning_rate": 0.0002,
      "grad_accum": 8,
      "dtype": "bfloat16"
    }
  },
  "measured": {
    "write": {
      "pass": 215,
      "semantic_pass": 215,
      "total": 223
    },
    "read": {
      "pass": 208,
      "semantic_pass": 208,
      "total": 213
    },
    "assemble": {
      "pass": 12,
      "semantic_pass": 12,
      "total": 12
    },
    "total": {
      "pass": 435,
      "semantic_pass": 435,
      "total": 448
    }
  },
  "urls": [
    "https://nl.1105software.com/v0/blobs/629dd950c3c6b1a353d5533fa418a87b527d8d8186d3fbf1ca59a604b26d1a3c",
    "https://nl.1105software.com/v0/blobs/c80fdef0a3e73835fb12234e36c2c174cdb920f34a49f02266d422c08f3074e9"
  ],
  "derived_from": null,
  "supersedes": "wgt_5698f82b0f13c4b8b86b8c93010a63eb1dda3fa5985ecdfdad3fa815de078bfb"
}
