{
  "schema_version": "0.1.0",
  "kind": "weights",
  "hash": "wgt_0782121ed631d02ff5515fdcfcfa3151fe281959c7523cc7586dd519d1c2c83f",
  "name_hints": [
    "nova-lingua-coder-3b",
    "reference-efficient"
  ],
  "base": {
    "model": "Qwen/Qwen2.5-Coder-3B-Instruct",
    "license": "Apache-2.0"
  },
  "format": "lora-peft-safetensors",
  "files": [
    {
      "name": "adapter_config.json",
      "sha256": "0d15f0d340682c9032b70c0a010b8757d532e61f81e5a89c7d737c6762d1785f",
      "bytes": 1109
    },
    {
      "name": "adapter_model.safetensors",
      "sha256": "a9bba22e6334b6f3388c38fa018f1508e4e3f576924da80c1f6e7ac131e934a9",
      "bytes": 119801528
    }
  ],
  "recipe": {
    "corpus": {
      "sha256": "dc893c505caa0c61ef5f9c40f7c0995822641ff609c6fcabd3f93ec7f71c0eb4",
      "description": "gen_corpus.py --combinatorial (verified synthetic training corpus)"
    },
    "train_split": {
      "sha256": "30cc0d35fe30bb71c07bf07e70583ba243c9a554b3f5a09866ee088bc7884ed3",
      "examples": 5885,
      "description": "export_finetune.py --conventions off --shots 0 --holdout-corpus (curated eval held out)"
    },
    "trainer": "tooling/eval/train_lora_cpu.py",
    "seed": 0,
    "epochs": 2,
    "hyperparameters": {
      "lora_r": 16,
      "lora_alpha": 32,
      "lora_dropout": 0.05,
      "target_modules": "all attn+MLP proj",
      "max_seq_len": 512,
      "learning_rate": 0.0002,
      "grad_accum": 8,
      "dtype": "bfloat16"
    }
  },
  "measured": {
    "write": {
      "pass": 181,
      "semantic_pass": 181,
      "total": 189
    },
    "read": {
      "pass": 161,
      "semantic_pass": 161,
      "total": 179
    },
    "assemble": {
      "pass": 12,
      "semantic_pass": 12,
      "total": 12
    },
    "total": {
      "pass": 354,
      "semantic_pass": 354,
      "total": 380
    }
  },
  "urls": [
    "https://nl.1105software.com/v0/blobs/0d15f0d340682c9032b70c0a010b8757d532e61f81e5a89c7d737c6762d1785f",
    "https://nl.1105software.com/v0/blobs/a9bba22e6334b6f3388c38fa018f1508e4e3f576924da80c1f6e7ac131e934a9"
  ],
  "derived_from": null,
  "supersedes": "wgt_6f61b11fc448f51fc62d911c45816e02495b478644750ec4708b0e517f417d39"
}
