{
  "schema_version": "0.1.0",
  "kind": "weights",
  "hash": "wgt_1fef913b9a214a2e04acdca91f766e22f628f81abf034cdf7c770c6373c3dec7",
  "name_hints": [
    "nova-lingua-coder-3b",
    "reference-efficient"
  ],
  "base": {
    "model": "Qwen/Qwen2.5-Coder-3B-Instruct",
    "license": "Apache-2.0"
  },
  "format": "lora-peft-safetensors",
  "files": [
    {
      "name": "adapter_config.json",
      "sha256": "e0a00f9da48852040df320217968c43c8383c04b1b48e446661f488b21a61fc3",
      "bytes": 1163
    },
    {
      "name": "adapter_model.safetensors",
      "sha256": "7630bbcd9ece63e246ebb67eff84673aa6ad0a7510324ac49ad91ad38ce453cc",
      "bytes": 119801528
    }
  ],
  "recipe": {
    "corpus": {
      "sha256": "badfe72cdd593628c2e015b3fd567cd3d29a13bc9895a2302d382fab6e7cff9e",
      "description": "gen_corpus.py --combinatorial (verified synthetic training corpus)"
    },
    "train_split": {
      "sha256": "3d6fd1127aa966a69ab1adff3599df101be618f9d990503a85bba08af4466a38",
      "examples": 6290,
      "description": "export_finetune.py --conventions off --shots 0 --holdout-corpus (curated eval held out)"
    },
    "trainer": "tooling/eval/train_lora_cpu.py",
    "seed": 0,
    "epochs": 2,
    "hyperparameters": {
      "lora_r": 16,
      "lora_alpha": 32,
      "lora_dropout": 0.05,
      "target_modules": "all attn+MLP proj",
      "max_seq_len": 512,
      "learning_rate": 0.0002,
      "grad_accum": 8,
      "dtype": "bfloat16"
    }
  },
  "measured": {
    "write": {
      "pass": 203,
      "semantic_pass": 203,
      "total": 223
    },
    "read": {
      "pass": 190,
      "semantic_pass": 192,
      "total": 213
    },
    "assemble": {
      "pass": 12,
      "semantic_pass": 12,
      "total": 12
    },
    "total": {
      "pass": 405,
      "semantic_pass": 407,
      "total": 448
    }
  },
  "urls": [
    "https://nl.1105software.com/v0/blobs/e0a00f9da48852040df320217968c43c8383c04b1b48e446661f488b21a61fc3",
    "https://nl.1105software.com/v0/blobs/7630bbcd9ece63e246ebb67eff84673aa6ad0a7510324ac49ad91ad38ce453cc"
  ],
  "derived_from": null,
  "supersedes": "wgt_0782121ed631d02ff5515fdcfcfa3151fe281959c7523cc7586dd519d1c2c83f"
}
