{
  "schema_version": "0.1.0",
  "kind": "weights",
  "hash": "wgt_83ad513dab1e98c4543e26842508c33a4daa69291e15dfdbcf8d5f5f2492b523",
  "name_hints": [
    "nova-lingua-coder-7b",
    "reference-best-write"
  ],
  "base": {
    "model": "Qwen/Qwen2.5-Coder-7B-Instruct",
    "license": "Apache-2.0"
  },
  "format": "lora-peft-safetensors",
  "files": [
    {
      "name": "adapter_config.json",
      "sha256": "97510c471bc35af63dc1a2b42fe42f9ff38c0f8fa95c94d466e4ce7fda1a1029",
      "bytes": 1109
    },
    {
      "name": "adapter_model.safetensors",
      "sha256": "91d8940345630806ef63ad77808d1785ff81f230785c4620d98faf9475891f2d",
      "bytes": 161533192
    }
  ],
  "recipe": {
    "corpus": {
      "sha256": "dc893c505caa0c61ef5f9c40f7c0995822641ff609c6fcabd3f93ec7f71c0eb4",
      "description": "gen_corpus.py --combinatorial (verified synthetic training corpus)"
    },
    "train_split": {
      "sha256": "30cc0d35fe30bb71c07bf07e70583ba243c9a554b3f5a09866ee088bc7884ed3",
      "examples": 5885,
      "description": "export_finetune.py --conventions off --shots 0 --holdout-corpus (curated eval held out)"
    },
    "trainer": "tooling/eval/train_lora_cpu.py",
    "seed": 1,
    "epochs": 2,
    "hyperparameters": {
      "lora_r": 16,
      "lora_alpha": 32,
      "lora_dropout": 0.05,
      "target_modules": "all attn+MLP proj",
      "max_seq_len": 512,
      "learning_rate": 0.0002,
      "grad_accum": 8,
      "dtype": "bfloat16"
    }
  },
  "measured": {
    "write": {
      "pass": 185,
      "semantic_pass": 185,
      "total": 189
    },
    "read": {
      "pass": 154,
      "semantic_pass": 162,
      "total": 179
    },
    "assemble": {
      "pass": 12,
      "semantic_pass": 12,
      "total": 12
    },
    "total": {
      "pass": 351,
      "semantic_pass": 359,
      "total": 380
    }
  },
  "urls": [
    "https://nl.1105software.com/v0/blobs/97510c471bc35af63dc1a2b42fe42f9ff38c0f8fa95c94d466e4ce7fda1a1029",
    "https://nl.1105software.com/v0/blobs/91d8940345630806ef63ad77808d1785ff81f230785c4620d98faf9475891f2d"
  ],
  "derived_from": null,
  "supersedes": "wgt_eb75d914b03ab2d10d5e7fda8b1e6e31d5834059be82c5da244b7976a515a9ea"
}
