{
  "schema_version": "0.1.0",
  "kind": "weights",
  "hash": "wgt_fd2b1c74cef80874c53b2bf7c1bea03a857e12db46b31fc5eefe357f806ed7f1",
  "name_hints": [
    "nova-lingua-coder-3b",
    "reference-efficient"
  ],
  "base": {
    "model": "Qwen/Qwen2.5-Coder-3B-Instruct",
    "license": "Apache-2.0"
  },
  "format": "lora-peft-safetensors",
  "files": [
    {
      "name": "adapter_config.json",
      "sha256": "452dccb771c352f9134cd65503854e4e3dcac6bd45fc267158628bd3359c4ce4",
      "bytes": 1109
    },
    {
      "name": "adapter_model.safetensors",
      "sha256": "ee27245f25e561997ebc57a52317be296f2e05bebdcca9e53be74f7958c61519",
      "bytes": 119801528
    }
  ],
  "recipe": {
    "corpus": {
      "sha256": "ceb9192fe9330eb4f6c5fba696a3961bc6a4e780483ef53ab90d6c6f993cddfd",
      "description": "gen_corpus.py --combinatorial (verified synthetic training corpus)"
    },
    "train_split": {
      "sha256": "9788ec9b5115fd4af92805c7d22fb9139a3ed041aeea05833895126144ccc54d",
      "examples": 5787,
      "description": "export_finetune.py --conventions off --shots 0 --holdout-corpus (curated eval held out)"
    },
    "trainer": "tooling/eval/train_lora_cpu.py",
    "seed": 1,
    "epochs": 2,
    "hyperparameters": {
      "lora_r": 16,
      "lora_alpha": 32,
      "lora_dropout": 0.05,
      "target_modules": "all attn+MLP proj",
      "max_seq_len": 512,
      "learning_rate": 0.0002,
      "grad_accum": 8,
      "dtype": "bfloat16"
    }
  },
  "measured": {
    "write": {
      "pass": 163,
      "semantic_pass": 163,
      "total": 179
    },
    "read": {
      "pass": 152,
      "semantic_pass": 153,
      "total": 169
    },
    "assemble": {
      "pass": 12,
      "semantic_pass": 12,
      "total": 12
    },
    "total": {
      "pass": 327,
      "semantic_pass": 328,
      "total": 360
    }
  },
  "urls": [
    "https://nl.1105software.com/v0/blobs/452dccb771c352f9134cd65503854e4e3dcac6bd45fc267158628bd3359c4ce4",
    "https://nl.1105software.com/v0/blobs/ee27245f25e561997ebc57a52317be296f2e05bebdcca9e53be74f7958c61519"
  ],
  "derived_from": null,
  "supersedes": null
}
